{"gateway":{"active":true,"inventorySha256":"c477bd66eb05921b536625ff8401f45fe3f97d97d4a7c2d0bf74ba5b0eccc2f8","unchanged":true},"ownedResources":{"containers":0,"networks":0,"volumes":0},"preexistingInventory":{"containerCount":14,"containersSha256":"5c87263ed208f4143fedb035e35681d34434a964417253ca57bcae00cb475ead","networkCount":18,"networksSha256":"566e67c448d5f7e706305d1df5a9fd9cdfa0e6916a925cee290050250ddf6b7f","unchanged":true,"volumeCount":30,"volumesSha256":"2d4bfda3b92be7968d78b7890a7df6692e96e90976b7f36a516bc3b19d373b4d"},"schemaVersion":"kaleidosphere.db/postgresql-e2e-cleanup/v1","secretDirectoryAbsent":true}
